{
  "name": "proto_techbase_v1",
  "theme": "techbase",
  "brief": "Start room, dim choke corridor into a hub with shotgun, then a brighter arena with imps.",
  "rooms": [
    {
      "id": "start",
      "x": 0,
      "y": 0,
      "w": 256,
      "h": 256,
      "floor_height": 0,
      "ceiling_height": 128,
      "floor_flat": "FLOOR0_1",
      "ceil_flat": "CEIL1_1",
      "light": 190
    },
    {
      "id": "hub",
      "x": 384,
      "y": 32,
      "w": 256,
      "h": 192,
      "floor_height": 0,
      "ceiling_height": 120,
      "floor_flat": "FLOOR0_3",
      "ceil_flat": "CEIL1_1",
      "light": 140
    },
    {
      "id": "arena",
      "x": 768,
      "y": 0,
      "w": 384,
      "h": 256,
      "floor_height": 0,
      "ceiling_height": 160,
      "floor_flat": "FLOOR1_1",
      "ceil_flat": "CEIL1_2",
      "light": 170
    }
  ],
  "connections": [
    { "a": "start", "b": "hub", "kind": "corridor", "width": 64 },
    { "a": "hub", "b": "arena", "kind": "corridor", "width": 96 }
  ],
  "things": [
    { "type": "Player1Start", "x": 96, "y": 128, "angle": 0 },
    { "type": "HealthBonus", "x": 160, "y": 96, "angle": 0 },
    { "type": "Clip", "x": 300, "y": 128, "angle": 0 },
    { "type": "Shotgun", "x": 480, "y": 128, "angle": 0 },
    { "type": "ArmorBonus", "x": 520, "y": 160, "angle": 0 },
    { "type": "Imp", "x": 900, "y": 100, "angle": 180 },
    { "type": "Imp", "x": 980, "y": 160, "angle": 180 },
    { "type": "Zombieman", "x": 860, "y": 180, "angle": 180 },
    { "type": "HealthBonus", "x": 700, "y": 128, "angle": 0 }
  ]
}
